{
  "$schema": "https://json-schema.org/draft/2020-12/schema",
  "$id": "synapsys://lane-b/graph-adapter-contract-v0.1",
  "title": "SynapSys Governed Object/Relationship Adapter Contract",
  "description": "Declared adapter contract for the input this compiler accepts. Stream A (Codex runtime/integration graph) is expected to return data conforming to this shape; until it returns, callers must supply either live-sourced data (evidence=LIVE_VERIFIED or LIVE_PARTIAL) or explicitly labelled fixtures (evidence=LABELLED_FIXTURE). The compiler fails closed on any relationship referencing an object id not present in objects, and on any object or view missing its required authority field.",
  "type": "object",
  "required": [
    "view_id", "title", "snapshot", "source", "evidence",
    "reality", "ppv", "authority", "return_route", "objects", "relationships"
  ],
  "additionalProperties": false,
  "properties": {
    "view_id": {
      "type": "string",
      "pattern": "^[a-z0-9_]+$",
      "description": "Stable profile identifier, e.g. n8n_topology, odoo_app_menu_object."
    },
    "title": { "type": "string", "minLength": 1 },
    "snapshot": {
      "type": "string",
      "description": "ISO-8601 timestamp of when the underlying data was read. Not used in structural determinism comparisons."
    },
    "source": { "type": "string", "minLength": 1 },
    "evidence": {
      "type": "string",
      "enum": ["LIVE_VERIFIED", "LIVE_PARTIAL", "LABELLED_FIXTURE", "STREAM_A_CONTRACT_PENDING"]
    },
    "reality": { "type": "string", "minLength": 1 },
    "ppv": { "type": "string", "minLength": 1 },
    "authority": { "type": "string", "minLength": 1 },
    "return_route": {
      "type": "string",
      "minLength": 1,
      "pattern": "^(?!.*->).+$",
      "description": "A single stable path or URL to the current Navigator primary interface. Must NOT contain literal arrow notation ('->') — that renders as an invalid hyperlink when reused as an href. Correction v0.1 (2026-08-01): was previously two segments joined by ' -> ', which broke the viewer's return link."
    },
    "objects": {
      "type": "array",
      "minItems": 1,
      "items": { "$ref": "#/$defs/object" }
    },
    "relationships": {
      "type": "array",
      "items": { "$ref": "#/$defs/relationship" }
    }
  },
  "$defs": {
    "object": {
      "type": "object",
      "required": ["id", "label", "kind", "lifecycle_state", "authority"],
      "additionalProperties": true,
      "properties": {
        "id": {
          "type": "string",
          "pattern": "^[A-Za-z0-9_.:-]+$",
          "description": "Stable ID. Must be unique within objects[]. Never regenerated between compiles of unchanged input."
        },
        "label": { "type": "string", "minLength": 1 },
        "kind": { "type": "string", "minLength": 1 },
        "lifecycle_state": {
          "type": "string",
          "enum": ["active", "held", "superseded", "failed", "candidate", "proposed", "retired", "draft"]
        },
        "authority": {
          "type": "string",
          "minLength": 1,
          "description": "Who/what authorises this object's current state. Required — compiler fails closed if absent."
        },
        "detail": { "type": "string" },
        "group": {
          "type": "string",
          "description": "Optional layout/semantic grouping column. Objects sharing a group are laid out in the same column."
        }
      }
    },
    "relationship": {
      "type": "object",
      "required": ["id", "from", "to", "verb"],
      "additionalProperties": true,
      "properties": {
        "id": { "type": "string", "minLength": 1 },
        "from": { "type": "string", "minLength": 1, "description": "Must match an objects[].id." },
        "to": { "type": "string", "minLength": 1, "description": "Must match an objects[].id." },
        "verb": { "type": "string", "minLength": 1, "description": "The relationship's verb, rendered as the edge label." },
        "lifecycle_state": { "type": "string" }
      }
    }
  }
}
