{
  "authority": "No production authority claimed; fixture author is this candidate compiler pass",
  "evidence": "LABELLED_FIXTURE",
  "objects": [
    {
      "authority": "steward_ratified",
      "group": "1_canon",
      "id": "ent_constitution",
      "kind": "canon_layer",
      "label": "Constitution",
      "lifecycle_state": "active"
    },
    {
      "authority": "steward_ratified",
      "group": "1_canon",
      "id": "ent_eom",
      "kind": "canon_layer",
      "label": "Operating Model (EOM)",
      "lifecycle_state": "active"
    },
    {
      "authority": "steward_ratified",
      "group": "1_canon",
      "id": "ent_sea",
      "kind": "canon_layer",
      "label": "Enterprise Architecture (SEA)",
      "lifecycle_state": "active"
    },
    {
      "authority": "steward_directed_working_definition",
      "group": "2_domains",
      "id": "ent_domains",
      "kind": "domain_layer",
      "label": "Domains D000-D010",
      "lifecycle_state": "active"
    },
    {
      "authority": "d007_operational",
      "group": "3_runtime",
      "id": "ent_runtime",
      "kind": "runtime_layer",
      "label": "Runtime (Odoo/N8N/Working Memory)",
      "lifecycle_state": "active"
    }
  ],
  "ppv": "Potential — fixture data, not a governed record",
  "reality": "FIXTURE — not implemented/live; structural demonstration only",
  "relationships": [
    {
      "from": "ent_constitution",
      "id": "e1",
      "to": "ent_eom",
      "verb": "governs"
    },
    {
      "from": "ent_eom",
      "id": "e2",
      "to": "ent_sea",
      "verb": "governs"
    },
    {
      "from": "ent_sea",
      "id": "e3",
      "to": "ent_domains",
      "verb": "structures"
    },
    {
      "from": "ent_domains",
      "id": "e4",
      "to": "ent_runtime",
      "verb": "operates_through"
    }
  ],
  "return_route": "Obsidian/00_HOME.md -> NAVIGATOR_MVP_v0.2/NAVIGATOR_MVP_PRIMARY_HOME_CANDIDATE_v0.2.md",
  "snapshot": "2026-08-02T02:15:00Z",
  "source": "declared_adapter_contract_fixture (schema/graph_schema.json) — LABELLED FIXTURE — placeholder structure demonstrating this compiler handles the enterprise view profile through the same code path as the live views. Not a reproduction of any existing canvas's real content; awaits Stream A's governed object/relationship JSON.",
  "title": "Enterprise Integrated — labelled fixture",
  "view_id": "enterprise"
}
